{
    "$schema" : "http://json-schema.org/draft-07/schema#",
    "title" : "Schema for basic development config",
    "description": "Allows for a basic json file that defines additional/overriding mounts and environment variables and such",
    "type" : "object",
        "properties" : {
            "title": {
                "type": "string",
                "description": "a title for the instance"
            },
            "description": {
                "type": "string",
                "description": "a description of the instance itself"
            },
            "schema": {
                "type": "string",
                "description": "relative path to the schema to use (this schema)"
            },
            "environment": {
                "$ref": "./environment.schema.json"
            },
            "mounts":{
                "$ref": "./mounts.schema.json"
            }
        },
        "required" : [
            "environment",
            "mounts"
        ],
        "additionalProperties" : false
}
